{
  "id": "media",
  "name": "Media",
  "version": "1.0.0",
  "author": "Presio",
  "description": "Plays the GIFs, videos and YouTube/Vimeo embeds in your PDF on their slides, in sync on every screen, with play, restart and audio controls on your current slide.",
  "main": "index.html",
  "surfaces": ["background", "slide"],
  "activation": ["attachment:media-slide-*.json"],
  "permissions": ["deck"],
  "contributes": {
    "keybindings": [
      { "command": "togglePlay", "label": "Play/pause media", "keys": [{ "key": "k" }] },
      { "command": "restart", "label": "Restart media", "keys": [{ "key": "r" }] }
    ]
  }
}
